[
  {
    "id": "discord",
    "label": "Discord",
    "url": "https://discord.com/users/davidsneighbour",
    "icon": "bi:discord"
  },
  {
    "id": "bluesky",
    "label": "Bluesky",
    "url": "https://bsky.app/profile/davidsneighbour.bsky.social",
    "icon": "bi:bluesky"
  },
  {
    "url": "https://www.threads.com/@pkollitsch",
    "id": "threads",
    "label": "Threads",
    "icon": "bi:threads"
  },
  {
    "id": "mastodon",
    "label": "Mastodon",
    "url": "https://mas.to/@davidsneighbour",
    "icon": "bi:mastodon"
  },
  {
    "id": "instagram",
    "label": "Instagram",
    "url": "https://www.instagram.com/pkollitsch/",
    "icon": "bi:instagram"
  }
]
